{
  "schemaVersion": "1.0",
  "manifestId": "EEC-C01-MG02",
  "bookSlug": "emociones-en-construccion",
  "editionKey": "emociones-en-construccion-1e",
  "chapterCode": "EEC-C01",
  "chapterOrder": 1,
  "unitKey": "dce92620-2398-5efb-80a4-b90b180a01ae",
  "canonicalVersion": "EEC_C01_v1.0_TEXT_LOCKED_2026-08-20",
  "canonicalSha256": "e10f42cedf881838578b7337355887c0e8cb2fe37b75dfa4204db509ac023018",
  "sourceArtifact": "artifacts/eec/C01/v1.0/feelverse/unit-payload.json",
  "experienceKey": "eec-c1-rostro-como-pista",
  "experienceVersion": 1,
  "guideKey": "eec-c1-rostro-como-pista",
  "guideVersion": 1,
  "conceptKey": "eec-rostro-como-pista",
  "practiceKey": "eec-c1-practice-una-sonrisa-varios-contextos",
  "recallKey": "eec-c1-recall-rostro-como-pista",
  "anchors": {
    "primary": {
      "reference": "eec-c1-rostro-como-pista",
      "heading": "Paul Ekman: el rostro como pista",
      "fingerprint": "un rostro ofrece pistas; no entrega una lectura completa de la experiencia",
      "expectedMatchCount": 1
    }
  },
  "scenes": [
    {
      "order": 1,
      "kind": "INTRO",
      "title": "Una sonrisa, varios contextos",
      "body": "Vas a comparar lecturas posibles de una misma expresión. No se trata de acertar la emoción: se trata de notar cuánta información aporta un rostro y dónde termina."
    },
    {
      "order": 2,
      "kind": "PASSAGE",
      "title": "El pasaje",
      "body": "Lee la sección sobre Ekman. El capítulo reconoce el aporte del rostro y también dónde la lectura directa se queda corta.",
      "anchorRef": "eec-c1-rostro-como-pista"
    },
    {
      "order": 3,
      "kind": "CONCEPT",
      "title": "Pista, no diccionario",
      "body": "Un movimiento facial aporta información, pero su significado depende de la persona, la situación y lo ocurrido antes. Un rostro ofrece pistas; no entrega una lectura completa de la experiencia.",
      "stepKey": "explorar-rostro-como-pista"
    },
    {
      "order": 4,
      "kind": "EXAMPLE",
      "title": "La misma sonrisa",
      "body": "La misma sonrisa puede aparecer al saludar por cortesía, al terminar algo que costaba, en una situación incómoda o al ver a alguien querido. El movimiento se parece; lo que ocurre alrededor, no."
    },
    {
      "order": 5,
      "kind": "PRACTICE",
      "title": "Varias lecturas plausibles",
      "body": "Ante una sonrisa en un contexto dado, ordena qué interpretaciones te parecen más y menos plausibles. Que haya varias posibles no significa que todas sean igual de probables.",
      "stepKey": "practicar-una-sonrisa-varios-contextos"
    },
    {
      "order": 6,
      "kind": "RECALL",
      "title": "Una pregunta",
      "body": "Comprueba la idea principal de esta microguía.",
      "stepKey": "recordar-rostro-como-pista"
    },
    {
      "order": 7,
      "kind": "SUMMARY",
      "title": "Lo que te llevas",
      "body": "El rostro informa. Lo que no hace es cerrar por sí solo la pregunta de qué está sintiendo alguien — y esa distinción cambia cómo escuchas."
    }
  ],
  "guideSteps": [
    {
      "order": 1,
      "kind": "CONCEPT_EXPLORATION",
      "stepKey": "explorar-rostro-como-pista",
      "targetKey": "eec-rostro-como-pista"
    },
    {
      "order": 2,
      "kind": "CATALOG_PRACTICE",
      "stepKey": "practicar-una-sonrisa-varios-contextos",
      "targetKey": "eec-c1-practice-una-sonrisa-varios-contextos"
    },
    {
      "order": 3,
      "kind": "ACTIVE_RECALL",
      "stepKey": "recordar-rostro-como-pista",
      "targetKey": "eec-c1-recall-rostro-como-pista"
    }
  ],
  "media": {
    "audio": null,
    "video": null
  },
  "privacyPolicy": {
    "freeTextLeavesDevice": false,
    "freeTextInProgress": false,
    "emotionalInference": false,
    "diagnosis": false,
    "requiresIntenseEmotion": false
  },
  "accessibilityRequirements": [
    "Navegación completa por teclado, con foco visible y orden de tabulación lógico.",
    "Toda reordenación anunciada por lector de pantalla mediante aria-live.",
    "Alternativa sin arrastrar para cualquier interacción de ordenamiento.",
    "Respeta prefers-reduced-motion.",
    "El color nunca es la única señal de estado.",
    "Ninguna reproducción automática y ningún audio o vídeo obligatorio."
  ],
  "status": "DRAFT",
  "publishAllowed": false,
  "idempotencyKey": "eec-c01-rostro-como-pista-v1-521db42de3bbe995",
  "approvalReferences": [
    "https://app.notion.com/p/3cfcbb1031a0813fb184fe6173d8a826",
    "Decisión autoral 2026-09-03: implementar las cinco microguías de EEC-C01."
  ],
  "manifestSha256": "7fc4536f1256221f75b751414d91cdb5fba75a85b2ca2276de768fa69bf96111"
}
